selecteer,uuid,entity_thumb,ft_fotonummer,photoid,ft_datum_jaar,ft_omschrijving,auteursrechten_vervaardiger_naam
,0d10b2a2-ae78-4bfd-a137-87cd10ed3117,,{1.60664},{HGA001000662},1962,"Mevrouw Blaaupot-Njo Pien woont in de Draaistraat nr. 9, geboren te Teloengagoengh, wordt 7 juli 1962 honderd jaar",Stokvis
,0d1215ac-ff38-4e88-9a2e-73e132b0c7fa,,{0.80437},{HGA001253641},1986,"Waldorpstraat, tegenover nr. 440","Kempff, P.G."
,0d167bbc-7adc-445a-9c74-8db8694ce127,,{0.14459},{HGA001058522},1981,"Burgersdijkstraat, gezien van de Antheunisstraat naar de Laakkade","Kempff, P.G."
,0d196fb9-c759-4de5-8e90-20ee3b1c08b2,,{0.43257},{HGA001413062},1861,"Lange Voorhout nr. 34, Koninklijke Bibliotheek","Tinne, Alexandrine"
,0d213b82-1797-4e9a-a68a-b4254973f059,,{0.44542},{HGA001414343},1986,"Leeghwaterplein, hoek tegenover 1e en 2e Van der Kunstraat","Kempff, P.G."
,0d274558-fc9c-46bc-9110-d59fb860bb6a,,{0.80205},{HGA001253407},1963,"Strand, bedekt met ijsschotsen",Stokvis
,0d2763aa-0d83-4f7e-ba69-56b186d754eb,,{860209},{HGA001860209},1945,Spui hoek Grote Marktstraat; het kringhuis van de N.S.B. wordt leeggehaald; reklamebord van de buurman Apotheek Dr. J. Blomberg; op de achtergrond een stuk van het Haagsch Modehuis,"Biegstraaten, F.W.H."
,0d2c81df-61bc-4268-a5d9-a39388c0e748,,{1.63151},{HGA001003118},1963,"Truus Hennepman-Krumming, atlete",Stokvis
,0d2cf31a-6e1b-43fa-9531-24a4d0713cd5,,{6.02297},{HGA001133025},1994,"Schiefbaanstraat, gezien van de Burnierstraat","Kempff, P.G."
,0d39a931-8d90-45b1-9851-4fab9d7ca740,,{0.24661},{HGA001068627},1964,"Grote Marktstraat hoek Voldersgracht, het nieuwe gebouw van de Hema",Stokvis
,0d3f9c6c-e3bf-464f-a85b-88033b4926b6,,{1.16607},{HGA001053906},1965,"Prins Bernhard bekijkt, nadat hij 's morgens de eerste prijs van 'World Press Photo' aan de Japanse fotograaf Kyochi Sawada in de Ridderzaal heeft uitgereikt, 's avonds met de prijswinnaar de tentoonstelling in het gemeentemuseum",Stokvis
,0d41fa09-d920-4677-b6fa-58c544ca68e4,,{0.44535},{HGA001414336},1982,Leeghwaterplein nrs. 25-26 (Vuga b.v. en Consumentenbond),"Kempff, P.G."
,0d47d8e3-d92f-41cd-b662-0e11baee33e5,,{883231},{HGA001883231},1964,"Burgemeester de Monchyplein, gezien vanuit het Stadhuis; de panden op de achtergrond staan aan de Javastraat","Korving, Jan"
,0d531712-fba8-4d34-aa56-018b94d9650e,,{0.57196},{HGA001429219},1981,"Pluvierstraat nr. 400, Duinrandschool, speelplaats","Kempff, P.G."
,0d5ff732-10a9-4f68-b648-b6f76b32f9ba,,{6.15382},{HGA001227304},1971,"Lange Poten, met een terras bij nummer 29",Stokvis
,0d61c0f6-7e95-475a-92de-04b3d23e1d44,,{0.10073},{HGA001035912},1978,"Bilthovenselaan, gezien van de Zuiderparklaan richting Blaricumseplein","Kempff, P.G."
,0d621674-4765-4ce9-a515-c112cda7fdc9,,{1.13670},{HGA001050988},1953,"Burgemeester mr. F.M.A. Schokking wenst Nico de Graaff geluk met zijn 50-jarig jubileum als orgelman. Links van Nico de Graaff, zijn vaste maat Huib Nette",Stokvis
,0d689e90-5dfd-49f0-8fcc-fda4b45c7c26,,{6.02319},{HGA001133047},1994,Bachmanstraat nr. 12 en hoger,"Kempff, P.G."
,0d6bfe98-23b7-4589-bee3-d27f3a961f73,,{870322},{HGA001870322},1975,"Plein 1813 nr. 3, Pakistaanse ambassade","Paans, M."
,0d6c5be0-4033-4880-b6aa-f13b484aab76,,{0.81544},{HGA001254749},1970,"Westbroekpark, hoofdprijs voor het jaarlijkse rozenconcours",Stokvis
,0d77111a-782d-47cf-8bbc-900d8a14fbf6,,{0.43436},{HGA001413240},1964,"Lange Voorhout nr. 38. De Spaanse ambassade. Voor de deur de ambassadeur en zijn vrouw, de heer en mevrouw José Manuel Aniel-Quiroga y Redondo",Stokvis
,0d780cb9-6ca4-46f6-b450-1f77a8bc8580,,{0.15359},{HGA001059419},1963,"Casuariestraat nr. 38, de zijgevel van het huis van Bewaring I met parkeerterrein aan de Schouwburgstraat",Stokvis
,0d78df83-494c-406c-9d96-8d9c244ee11a,,{1.17517},{HGA001054811},1968,"De Nederlandse en Indiase regeringen ondertekenen een overeenkomst omtrent een lening van 33 miljoen aan India. V.l.n.r. mr. Y.T. Shah, minister van Financiën van India, mr. C.A. baron van Bentinck, president-directeur van de Nationale Investeringsbank N.V. en mr. P.C. Maas, directeur-secretaris van dezelfde bank",Stokvis
,0d7c33fe-c2f6-48be-ae01-8519691c6b56,,{820215},{HGA001255840},1980,Luchtfoto Bezuidenhout; Centraal Station en omgeving. Op de voorgrond de nieuwbouw rondom het Jan van Riebeekplein.,Delta-Phot
,0d9124d7-8020-4225-b187-ce9bcc91d168,,{860290},{HGA001860290},1945,"Plein, gezien vanuit de Lange Houtstraat; intocht geallieerden","Biegstraaten, F.W.H."
,0da22be2-e50d-4f65-a2e8-0612d95c9f88,,{0.16406},{HGA001060395},1982,Cromvlietplein nrs. 40-1,"Kempff, P.G."
,0da80c6a-8af4-4059-9dfd-a156bc6b9b38,,{0.29545},{HGA001402398},1988,Hoogstraat nr. 25. Achterzijde met tuin van de parfumerie- en byouteriewinkel E. Rimmel,"Kempff, P.G."
,0da8b0f5-0fab-49e6-9c74-9107c1fb1e23,,{0.37281},{HGA001407104},1982,"Ketelstraat, vanaf nr. 27","Kempff, P.G."
,0dab5ed7-f61d-4958-af19-38f5d6e7df2a,,{1.13608},{HGA001050926},1953,Koningin Juliana drinkt een glas melk bij haar bezoek aan de zuiveltentoonstelling 'de Melkweg' in de Houtrusthal,Stokvis
,0db3a452-9f5a-4bd1-8f4e-eafb6645e68a,,{0.39675},{HGA001409488},1964,"Korte Voorhout, toneelzaaltje 't Paradijs op een van de zolders van de Kon. Schouwburg. Foto van een repetitie voor de premiere van Slawomir's Mrozeck's 'Politie' waarmee de zaal in gebruik zal worden genomen. V.l.n.r. John Koch, Kees Coolen, Wim de Haas, Bas ten Batenburg",Stokvis
,0dde4f87-290c-422d-a0e4-c75076a199f9,,{0.27040},{HGA001400244},1981,"Haverschmidtstraat nrs. 121 en lager, gezien van de Linnaeusstraat richting Isingstraat","Kempff, P.G."
,0ddef214-f9e5-4af9-b2bc-86cd3e6e7858,,{0.43927},{HGA001413730},1971,Lange Voorhout nrs. 31-29 en 27,Stokvis
,0ddf14d8-5272-400e-a66a-0558e96069e1,,{870408},{HGA001870408},1975,Prinsegracht,"Paans, M."
,0dfc475e-d4ca-4a67-883c-d1ef330b04e2,,{1.18210},{HGA001055502},1970,De minister van Binnenlandse Zaken mr. H.K.J. Beernink sluit de zitting 1969-1970 van de Staten-Generaal op het Binnenhof,Stokvis
,0dfcc39d-dd2c-469f-baad-59fa66d14101,,{820859},{HGA001301477},1973,D'Aumeriestraat nrs. 40 en 46,[ onbekend ]
,0dfd5e1c-ae78-491e-8bf8-55913587e2a9,,{0.64978},{HGA001436971},1971,"Soestdijksekade, met woonboten",Stokvis
,0e062691-87af-4967-b7b7-f63a78dd04cd,,{0.05884},{HGA001031745},1981,"Allard Piersonlaan nrs. 49-15, gezien naar de Isingstraat","Kempff, P.G."
,0e0acb5a-18d5-485e-9b90-8fd66150486c,,{1.22736},{HGA001022086},1978,Opening van het zomerfeest van Buurtschap Centrum 2005 met 'Alexandrine Time' - echtgenote van een kunsthandelaar,Meyer/Stokvis
,0e138b7e-94da-4cc0-835c-d7b2743ea094,,{820844},{HGA001301447},1910,Nieuwe Uitleg nrs. 25 en 24,[ onbekend ]
,0e18c1cf-db72-4f35-86a7-47cbd7cb8991,,{400156},{HGA001311392},1984,"Beeklaan hoek Stephensonstraat, tegeltableau (Rozenburg) boven de zuivelwinkel van Frank Straathof.","Rouwendaal, Theo"
,0e1a10b4-4573-4d6b-b68f-fed2b1c614e9,,{1.20775},{HGA001020131},1976,"Burgemeester drs. F.G.L.L. Schols brengt een werkbezoek aan het Gemeentearchief. Hij kijkt aandachtig naar de heer P.J. van Dijk, die met bindwerk bezig is op het restauratie-atelier. V.l.n.r. de chef van het restauratie-atelier W. Kunz, adjunct-gemeentearchivaris drs. H. Bordewijk, de burgemeester, gemeentearchivaris drs. H.M. Mensonides en binder J. Zanoni (achtergrond)","Kempff, P.G."
,0e22be86-90a4-4ac8-bf41-0a02ce030cd3,,{880786},{HGA001014913},1990,"Segbroeklaan, plantsoen met op de achtergrond de achterzijde van de huizen aan de Sportlaan.","Kempff, P.G."
,0e264d08-6681-4291-9ed0-bc143855f240,,{0.40979},{HGA001410786},1982,"Laakweg, ongeveer vanaf nr. 177A gezien richting Slachthuisstraat","Kempff, P.G."
,0e282c9d-04c0-4106-ac99-a43e656cb923,,{0.06012},{HGA001031873},1979,"Amazonestraat 115-93, gezien van de Beetsstraat","Kempff, P.G."
,0e319498-291b-466b-a7e0-8bcdc06e17ad,,{0.81342},{HGA001254547},1981,"Wenckebachstraat nrs. 9A-1, gezien van de Zuigerstraat naar de Noordpolderkade","Kempff, P.G."
,0e31ecca-2bdc-4a84-9efb-1f95c2d5c88c,,{1.22661},{HGA001022011},1978,"Begrafenis van de acteur Ko van Dijk. Paul van Gorkum, Erik Vos, Eric Schneider en Sacco van der Made (v.l.n.r.) houden de ere-wacht tijdens de opbaring in de Koninklijke Schouwburg",Meyer/Stokvis
,0e338ff7-b2a2-4223-bef6-d59796614e95,,{0.84595},{HGA001260309},1990,Zuiderpark; tuin tussen Anna Polakweg en Marie Jungiusweg met beeld 'Fluitspeler'.,"Kempff, P.G."
,0e4031f6-e3d3-4f13-af0c-85f15f7fa5db,,{0.67187},{HGA001440360},1982,Stadstuinen vanaf nr. 43 richting Oude Haagweg,"Kempff, P.G."
,0e45d3cc-b0a4-4a72-a951-22732ee81579,,{0.72704},{HGA001244153},1982,"Van Leeuwenhoekstraat nrs. 46-60, gezien richting Rijswijkseweg","Kempff, P.G."
,0e471b76-7d96-4d1a-bb22-6d348b6162f1,,{1.17225},{HGA001054520},1967,"De hoofdcommissaris van politie J.H.A.K. Gualthérie van Weezel, geeft als voorzitter van het Koningin Wilhelmina Fonds, afdeling 's Gravenhage, het startsein voor de activiteiten rond de collecte van 11-16 september. Voor het hoofdbureau van politie aan het Burgemeester de Monchyplein stopt hij een gulden in de collecte-bus",Stokvis
,0e4c2414-6eb8-4573-bfc7-27a09c4a0589,,{1.17629},{HGA001054923},1968,"Brand in de computerkelder van de B.P.M., Carel van Bylandtlaan nr. 30","Brugge, G.J. ter"
,0e4da333-970f-4926-bea5-00888fc16ad3,,{870594},{HGA001870594},1975,"Prinsessegracht nr. 29, Residentie van de Turkse ambassadeur, detail van de entree","Paans, M."
,0e4f5f97-4556-4a7b-965c-f2abe8749512,,{6.02411},{HGA001133223},1994,"Breitnerlaan, even zijde tussen de Pieter Meinersstraat (voorgrond) en de Hart Nibbrigkade, feitelijk de zijkant van Hart Nibbrigkade nr. 71","Kempff, P.G."
,0e4f94b1-fec4-4e5b-9ebc-cc46c69f4043,,{1.60271},{HGA001000269},1960,"José Ruiz de Araña, Hertog van Baëna, Spaanse ambassadeur tot 1963, met Sinterklaas",Stokvis
,0e525ad0-9ce6-4eee-aede-1887cba8c74a,,{5.16029},{HGA001516029},1920,"Westvlietweg nr. 69, villa die tot 1-1-2002 in de gemeente Leidschendam stond. Rechts een gedeelte van de Voorburgsche Houthandel v/h L. v.d. Ham N.V.",[ onbekend ]
,0e644b2e-c91a-49ed-b0df-6e202ba786fa,,{0.71691},{HGA001444444},1992,"Van Brederodestraat nrs. 32 en hoger, gezien naar de Douzastraat","Kempff, P.G."
,0e656ce8-1aa6-41ad-bdb7-ea98d78118d6,,{1.15939},{HGA001053239},1963,Viering van de 150-jarige onafhankelijkheid. Opvoering van het toneelstuk 'Een keerend getij ' in het Kurhaus,Stokvis
,0e71fc2c-3737-4346-aabf-6d12351a2271,,{1.16928},{HGA001054223},1967,Huwelijk van prinses Margriet en mr. Pieter van Vollenhoven. Prinses Irene en prins Carel Hugo van Bourbon Parma in de raadzaal aan de Javastraat,Stokvis
,0e76316d-6f6e-4fbf-8ccd-8381e0d46fe3,,{0.49311},{HGA001421377},1980,"Nannostraat nrs. 2-60, gezien van de Beetsstraat naar de Alberdingk Thijmstraat","Kempff, P.G."
,0e78af04-49a0-4642-afae-9b785a7b26d3,,{1.13556},{HGA001050874},1953,"Receptie in het Parkhotel van het echtpaar Dinkhuizen ter gelegenheid van hun vijftigjarige echtvereniging, de heer A.H.J. v.d. Boogaard biedt het echtpaar een fruitmand aan",Stokvis
,0e79f7f9-a60d-448d-8132-d292dee88139,,{1.22660},{HGA001022010},1978,"De minister van Binnenlandse Zaken, H. Wiegel, de secretaris-generaal mr. P. van Dijke en de staatssecretaris mr. H.E. Koning bekijken het boek 'Van ambachtelijk tot ambtelijk', geschreven door Gerda van Beek en drs. W.M. van der Mast, aangeboden bij de ingebruikneming van het nieuwe ministerie, Schedeldoekshaven",Meyer/Stokvis
,0e84947a-ca50-4e99-9075-3b18dabe8a61,,{0.14647},{HGA001058709},1979,"Camera Obscurastraat nrs. 68-108, gezien naar de Vosmaerstraat","Kempff, P.G."
,0e872c77-81a7-4922-9103-856341b181e9,,{0.05569},{HGA001031430},1980,"Alberdingk Thijmstraat nrs. 1-27, gezien richting Beetsstraat","Kempff, P.G."
,0e884786-e576-4001-b345-c0fb02a4c394,,{0.29374},{HGA001402229},1989,"Hooftskade nr. 195. Haags Krachtsportcentrum H.K.V.-Simson-K.D.O., voorheen distilleerderij 'De Ooievaar'","Kempff, P.G."
,0e8bcb72-4094-4c80-9321-f02203db588d,,{0.80494},{HGA001253698},1960,"Walenburg nr. 17, openbare school, metaalplastiek van Jan Goeting tegen de buitenmuur van het gymnastieklokaal; dit is de eerste school in Mariahoeve en is door wethouder Zwijndrecht op 15 maart 1960? geopend",Stokvis
,0e8dc2bb-8709-450c-b682-ff971a754cd9,,{0.63688},{HGA001435687},1987,"Scheveningseweg, Joodse begraafplaats, restauratie","Kempff, P.G."
,0e8f7769-695a-47e9-a01a-15b066341e85,,{0.63551},{HGA001435552},1981,"Scheveningseweg nr. 54, Morrenkamer in de dépendance van het Gemeentearchief","Kempff, P.G."
,0e9858b2-1131-4f5e-8201-20fe2bab5010,,{0.14593},{HGA001058655},1978,"Calandplein nrs. 22-17, gezien van de 1e Lulofsdwarsstraat naar de 2e Lulofsdwarsstraat","Kempff, P.G."
,0ea331d5-13ca-4aaa-9253-80bf638f039d,,{0.43174},{HGA001412979},1960,"Lange Voorhout, Kloosterkerk, proef met door Charles Eyck vervaardigde glas in loodramen, voorstellend Christus in zijn drievoudig ambt van priester, profeet en koning",Stokvis
,0eb6464a-6d2a-43ce-8b6f-64b05c25db36,,{0.63790},{HGA001435789},1979,Schimmelweg nrs. 359-351 tussen de Multatulistraat (links) en de Jonathanstraat,"Kempff, P.G."
,0ebe3dfe-10b7-4728-b25a-cec54302b335,,{870173},{HGA001301773},1975,"Scheveningse Bosjes, waterpartij, gezien door het plastiek 'Granito nr. 9' (Hans Kleyweg)",Stokvis
,0ec3a44c-beee-46f2-9eb0-4f1f3eed782a,,{0.25929},{HGA001069884},1972,"Haagse Bos, Huis ten Bosch, de feestloper wordt uitgerold",Stokvis
,0ed9049f-91d2-444f-a2c2-6c255db8a294,,{0.60234},{HGA001432244},1981,"Reinwardtstraat nrs. 101-3, gezien van de Oudemansstraat richting Van Musschenbroekstraat","Kempff, P.G."
,0edd90d2-3cb6-4c96-a7d4-1fe8b0798695,,{870319},{HGA001870319},1975,"Nassaulaan, Willemskerk","Paans, M."
,0ee35215-afa8-4735-b539-90df85b05850,,{0.74129},{HGA001245585},1978,"Viviënstraat nrs. 12, 14 en 16","Kempff, P.G."
,0eeb7a46-a7ee-44fd-bc17-01ed244ff7aa,,{0.71694},{HGA001444447},1992,"Van Brederodestraat tussen het Van St. Algondeplein (links) en de Van Egmondstraat, links nrs. 1A-3","Kempff, P.G."
,0efebdd3-9744-4cf0-a1e6-068ec5d2a150,,{0.51969},{HGA001424034},1982,"Noordpolderstraat, oneven zijde tussen Stortstraat en Noordpolderkade","Kempff, P.G."
,0f09644f-72af-4a63-ad4b-12cc63458de2,,{870817},{HGA001870817},1970,"Lange Vijverberg, hoek Kneuterdijk, tijdens een sneeuwbui",Stokvis
,0f1c27e1-76f6-4274-8dd5-4e1a2244daf3,,{0.20639},{HGA001064612},1979,"Gerrit Witsestraat nrs. 2-18, gezien van de Camera Obscurastraat naar het Hildebrandplein","Kempff, P.G."
,0f21de83-0fd5-496a-b921-a840af1df1b4,,{1.13605},{HGA001050923},1953,"Het weer aanbrengen van de klokken in het torentje van het oude stadhuis, nadat zij 10 jaar geleden door de Duitsers waren weggehaald",Stokvis
,0f22a568-944d-4729-9ef8-08fbb8c2335b,,{0.48671},{HGA001420740},1981,"Miquelstraat, gezien naar het Lorentzplein","Kempff, P.G."
,0f381d6e-57b3-4ac0-8d23-fd5a7c276510,,{1.17184},{HGA001054479},1967,Doop van prins Willem Alexander. Prinses Christina en mejuffrouw Christina von Amsberg dalen de trappen af van paleis Huis ten Bosch op weg naar de Grote Kerk,Stokvis
,0f387c44-3e30-4955-b83b-d89a2c3d5e3d,,{860241},{HGA001860241},1945,"Laan van Nieuw Oost-Indië, ter hoogte van het benzinestation van Van der Heijden; geallieerden in een tank","Biegstraaten, F.W.H."
,0f3bf744-0e8d-4483-9f2d-ce4131907d05,,{0.61704},{HGA001433710},1982,"Rijswijkseweg nrs. 107-83, tussen Lyonnetstraat en Laakkade","Kempff, P.G."
,0f3db302-42ce-41ff-92f9-1d879e9d00cf,,{1.18602},{HGA001055893},1972,Prof. de Winter houdt een herdenkingsrede ter gelegenheid van het 75-jarig bestaan van de staatscommissie voor het Internationale Privaatrecht. Links de minister van Buitenlandse Zaken drs W.K.N. Schmelzer,Stokvis
,0f4a75eb-b7ed-49ad-aa80-ba1a53d917d1,,{0.71870},{HGA001444623},1957,"1e van den Boschstraat, rechts rijksgebouw, gezien Bezuidenhoutseweg, rechts de Theresiastraat",Stokvis
,0f5de10e-6f16-4fe9-93ad-a52013e1abd8,,{0.14686},{HGA001058748},1980,"Camera Obscurastraat, gezien van de Hasebroekstraat richting Vosmaerstraat","Kempff, P.G."
,0f6bff91-7c46-4b43-9210-04b06c49db3f,,{0.31249},{HGA001404092},1981,"Jan van Beersstraat, gezien van de Van Zeggelenlaan richting De Genestetlaan","Kempff, P.G."
,0f70e28a-fc02-49b3-bf05-441cfdab9aa2,,{0.24192},{HGA001068159},1968,"Groot Hertoginnelaan, hoek Sweelinckstraat, met een kantoor in aanbouw (verzekeringen)",Stokvis
,0f755bd3-e9ed-4df4-981b-d5619802c444,,{1.17493},{HGA001054787},1968,"De minister van Cultuur, Recreatie en Maatschappelijk Werk mej. dr. M.A.M. Klompé, reikt de staatsprijs voor letterkunde (P.C. Hooftprijs) 1967 uit aan de heer L.J. Swaanswijk (Lucebert) voor zijn gehele oeuvre. In het midden mevrouw Swaanswijk. De plechtigheid geschiedde op het ministerie van Cultuur, Recreatie en Maatschappelijk Werk",Stokvis
,0f77c973-8f27-4b09-b0a1-f19282e2f752,,{0.44533},{HGA001414334},1982,Leeghwaterplein nr. 3 (Ruys Kantoormachines),"Kempff, P.G."
,0f781c2c-f713-4a40-be01-d68b604df0ed,,{0.64423},{HGA001436417},1979,"Sinjeur Semeynsweg nrs. 229-171, gezien van de Guido Gezellestraat via de Hugo Verrieststraat naar de Van Zeggelenlaan","Kempff, P.G."
,0f7f4e9f-be3a-497f-ae5e-fee63f639b4b,,{0.46794},{HGA001439096},1978,"Lunterenstraat, gezien van de De la Reyweg naar de Apeldoornselaan","Kempff, P.G."
,0f80633e-5dbd-4c03-b792-35ba697bab21,,{0.05412},{HGA001031273},1978,Adriaan Pauwstraat nrs. 44-46,"Kempff, P.G."
,0f84f21d-ab5a-4247-b512-3deeaa9d8cbe,,{0.73168},{HGA001244616},1975,Van Ostadewoningen,"Kempff, P.G."
,0f86d219-bac5-4b69-a24c-46cc289645e4,,{5.15656},{HGA001515656},1910,"Gezicht vanaf waarschijnlijk de Helmersstraat op de sloot ter hoogte van de latere Crispijnstraat, met rechts een gebouw dat hoort bij houtzagerij De Nijverheid. Links de achterzijde van huizen aan de Veenkade. Op de achtergrond de Haasmolen. De tram staat op de latere Waldeck Pyrmontkade",[ onbekend ]
,0f870d4e-23b5-447b-aee8-be6a10d13bd3,,{0.24071},{HGA001068038},1978,"Groot Hertoginnelaan nr. 258, hoek Voltastraat","Kempff, P.G."
,0f8a4450-74ab-48aa-93e5-931785b9b298,,{0.14692},{HGA001058754},1980,"Camera Obscurastraat nrs. 277-251, gezien van de Schimmelweg richting Busken Huetstraat","Kempff, P.G."
,0f8cc26c-ff85-4492-9c09-3d2edd179c95,,{0.36470},{HGA001406295},1980,"Keggestraat nrs. 7-1, gezien van het Hildebrandplein","Kempff, P.G."
,0f923853-95fc-4f25-b3fd-aa5469d0f9c1,,{870205},{HGA001301805},1975,"Madurodam, het Binnenhof met de Ridderzaal",Stokvis
,0f9d75db-8506-4da6-b978-c7fa6b319a75,,{6.02305},{HGA001133033},1994,Dedelstraat nrs. 14-2,"Kempff, P.G."
,0fa05c9b-96fc-468b-ad63-30e0c8333a9d,,{0.38763},{HGA001408583},1975,"Koningskade hoek Wassenaarseweg, sloop","Kempff, P.G."
,0fb98e7e-2f64-4c93-aae7-87d4ab0c3fa2,,{870535},{HGA001870535},1975,"Groenmarkt, Grote of Sint Jacobskerk, interieur naar het orgel gezien","Paans, M."
,0fba5e79-7d09-4af7-94a1-c0cd52b54840,,{1.17717},{HGA001055011},1969,"Een tot op het hemd uitgeklede pop en teksten die er niet om liegen bij 'Al-Veka', Denneweg nr. 56, demonstreren het ongenoegen over de Belasting Toegevoegde Waarde (B.T.W.). Rechts de winkelier Bram van Pijpen",Stokvis
,0fbb33fa-2e7d-4efb-877a-0f3d5a70f394,,{0.14656},{HGA001058718},1979,"Camera Obscurastraat nrs. 2-36 en 33-1, gezien naar de Keggestraat","Kempff, P.G."
,0fcb295e-559f-4fcc-bb99-54982c013b49,,{0.08186},{HGA001034033},1980,"Beetsstraat nrs. 147-143, gezien van de Vosmaerstraat","Kempff, P.G."
,0fcdc9cf-ce9b-4a4a-af20-a797300202b9,,{0.73612},{HGA001245061},1981,"Van Zeggelenlaan nrs. 8-74, gezien van de Capadosestraat naar de Pieter Spastraat","Kempff, P.G."
,0fcf8efd-c625-4891-8202-a60ab94f488b,,{0.36437},{HGA001406262},1980,Keggestraat nrs. 66-96; rechts de Vosmaerstraat,"Kempff, P.G."
,0fd21756-0028-4128-aaae-4f67e5c8e4fb,,{0.09652},{HGA001035493},1967,"Bezuidenhoutseweg nr. 60, het gebouw van de Sociaal Economische Raad (SER)",Stokvis
,0fe958c1-1f5e-4fc5-abfc-68d3449c761a,,{6.02333},{HGA001133061},1994,"Van Wouwstraat, gezien van de Ridderlaan","Kempff, P.G."
,0ff3753c-d8b5-4049-9b5c-022606a5d28f,,{820384},{HGA001256009},1984,Luchtfoto Zuiderpark en omgeving met het zwembad en het voetbalstadion. Op de voorgrond de Melis Stokelaan.,Delta-Phot
,0ff4ae7e-174d-4c36-893a-78ec40f3e0ce,,{0.12030},{HGA001037857},1989,Boekhorststraat nrs. 69-77,"Kempff, P.G."
,0ff58e73-bd9b-4361-9087-75fed709475a,,{0.15427},{HGA001059487},1975,"Celebesstraat, gezien van de Borneostraat naar de Timorstraat, links nr. 2, de laagbouw rechts daarvan is nr. 4, 'Het Klokhuis'","Kempff, P.G."
,0ff6477f-8915-4152-9032-128d3b89d531,,{1.13409},{HGA001050727},1952,"Dr. Max Euwe (rechts) overhandigt mr. A. Rueb, erevoorzittervan de Koninklijke Nederlandse Schaakbond, een bos bloemen ter gelegenheid van diens 70e verjaardag, links de voorzitter van de K.N.S.B., ir. H.J. van Steenis",Stokvis
,0fffc0ef-2387-426d-9b4e-735637efb520,,{820309},{HGA001255934},1982,Luchtfoto Bezuidenhout. Op de voorgrond het Ministerie van Buitenlandse Zaken in aanbouw en daarnaast het Algemeen Rijksarchief. Centraal de kruising Utrechtse Baan / Theresiastraat met het Ministerie van Landbouw en Visserij en het Paleis van Justitie.,Delta-Phot
,1001a955-b2b4-4d19-b9cf-aa5a5b6ff93b,,{0.14416},{HGA001058479},1992,"Burgemeester Van der Werffstraat achterzijde van de school aan de Jan van Houtstraat nr. 127, gezien naar de Westduinweg","Kempff, P.G."
,1002300c-7139-4570-9dea-e87c6ab0234e,,{883149},{HGA001883149},1976,"Strandpaviljoen, vermoedelijk in het Westduinpark","Vries, Jan de"
,100f875c-95f9-41d5-9efb-9e5b65941ccd,,{1.18549},{HGA001055840},1972,Minister-president mr. B.W. Biesheuvel ontvangt de Noorse premier Trygve Bratelli (links) in het Catshuis,Stokvis
,100fe4b2-0cb5-42ac-94f5-739aaa158f8c,,{0.72985},{HGA001244433},1981,"Van Musschenbroekstraat nrs. 259-207, gezien van het Lorentzplein richting Isingstraat","Kempff, P.G."
,101288a7-7ca6-4440-bc13-68fca33cb5bd,,{0.56619},{HGA001428670},1956,"Plein, Ministerie van Buitenlandse Zaken, conferentie van de Ministers van Buitenlandse Zaken van de Benelux-landen in het Ministerie van Buitenlandse Zaken, van links naar rechts J. Bech (Luxemburg), mr. J.W. Beijen en P.H. Spaak (België)",Stokvis
,10156c06-49ec-43e4-9980-e32236323c45,,{6.02312},{HGA001133040},1994,"Groenhovenstraat, achtergevel van een gebouw van Shell (Carel van Bylandtlaan nr. 30). Gezien naar de Oostduinlaan","Kempff, P.G."
,101be59c-d408-4261-9feb-245fcf7f8dca,,{0.61694},{HGA001433700},1982,Rijswijkseweg nrs. 49-25,"Kempff, P.G."
,103988bb-c69a-45b8-b3d4-1e4c4af0457a,,{0.85702},{HGA001261500},1980,Luchtfoto Den Haag. Met op de voorgrond de Stationsbuurt (midden en rechts) en de Schilderswijk (links),Meyer/Stokvis
,1044efb8-534f-4c68-be63-8f2a620267ca,,{0.29280},{HGA001402135},1994,"Hollanderstraat nrs. 15-31, gezien van de kant van de Koningin Emmakade","Kempff, P.G."
,1049db92-b03b-44d0-8fad-8b10f9e4f49a,,{820228},{HGA001255853},1980,Luchtfoto van Kijkduin en omgeving. Centraal het villapark Kijkduin en links daarvan de Machiel Vrijenhoeklaan.,Delta-Phot
,1057dd13-eb30-4284-8fcd-a5382bff5995,,{0.29281},{HGA001402136},1994,"Hollanderstraat nrs. 15-31, gezien in de richting van de Koningin Emmakade","Kempff, P.G."
,105c9036-fa32-47c3-816f-dd3b90d1755a,,{0.14494},{HGA001058557},1980,"Busken Huetstraat nrs. 32-48, gezien van de Camera Obscurastraat naar de Beetsstraat","Kempff, P.G."
,10619797-79ef-42a4-bc3d-1233b7830eca,,{0.65228},{HGA001437220},1954,"Spaarwaterstraat nr. 21, de Van Hoogstratenschool op 1 september 1954 in gebruik genomen",Stokvis
,1061e1af-921b-44b9-8094-317f856dff77,,{0.43479},{HGA001413282},1975,Lange Voorhout. Hotel des Indes. Zijgevel met op de voorgrond daken van panden aan de Vos in Tuinstraat,"Kempff, P.G."
,10631e1e-aaf2-42ac-9f0b-979d4370e0dd,,{6.02348},{HGA001133160},1994,"Utenbroekestraat, gezien van de Van Nijenrodestraat","Kempff, P.G."
,107405db-0da3-4476-a0e0-2eaa6a6041d1,,{6.15404},{HGA001017968},1970,"Luchtfoto van het Bezuidenhout, met van middenonder naar boven de Charlotte de Bourbonstraat, en boven het midden de Prinses Beatrixlaan met nieuwe kantoorgebouwen voor o.a. Nationale Nederlanden. Linksboven het Haagse Bos. Aan de linkerkant, iets boven het midden, het Paleis van Justitie in aanbouw",Stokvis
,10798b4d-3056-44a8-bb03-0f461fc84e37,,{0.47142},{HGA001439194},1975,"Malakkastraat nr. 1 bis, zitkamer, gezien naar de open keuken","Kempff, P.G."
,1084bc4a-976b-4bcd-9831-3ae66776114c,,{0.11793},{HGA001037621},1982,Binnentuinen nrs. 1-27,"Kempff, P.G."
,109dcfca-5d2d-4e70-8b2e-d9ad193b0899,,{0.08191},{HGA001034038},1980,"Beetsstraat nrs. 223-189, gezien richting Vosmaerstraat","Kempff, P.G."
,10a838d3-c5a8-41f1-9cff-68d51711231e,,{0.64047},{HGA001436042},1993,"Schouwensestraat, even zijde gezien van de Pluvierstraat in de richting van de Markensestraat","Kempff, P.G."
,10baa2e8-5e87-4bd9-aff7-0ea477260071,,{1.61517},{HGA001001514},1971,"Rahat Said Chatari, ambassadeur van Pakistan",Stokvis
,10bea39c-9ce3-459b-84df-f4f36857ba1f,,{0.29661},{HGA001402512},1989,"Hooikade, detail van de Hooikadebrug, vervaardigd door de ijzergieterij 'De Prins van Oranje' in 1866","Kempff, P.G."
,10cbe5c1-a028-40f3-a084-d622d243775d,,{1.15583},{HGA001052885},1962,Opening van de nieuwe vleugel van het Gemeentemuseum. Prinses Beatrix wordt rondgeleid,Stokvis
,10e6c298-990c-4815-b92f-51155267fb55,,{0.18390},{HGA001062371},1982,"Elboogstraat, vanaf het Cromvlietplein","Kempff, P.G."
,10f29947-da03-4439-803f-2b5b251e5c4a,,{0.40724},{HGA001410531},1981,"3e Laakdwarsweg nrs. 19-1, gezien van de Molenslootstraat naar de Laakweg","Kempff, P.G."
,1100686b-4204-478e-812c-0856830398ee,,{6.15392},{HGA001227314},1981,Demonstratie bij het Vredespaleis tegen het anti-homo beleid van de Amerikaanse president Ronald Reagan,Stokvis
,110a5284-a1fb-49c3-8952-0fbb16273e3c,,{0.22529},{HGA001066497},1981,"Griendsestraat nrs. 19-1 en 2, gezien van de Markensestraat naar de Wieringsestraat","Kempff, P.G."
