selecteer,uuid,entity_thumb,ft_fotonummer,photoid,ft_datum_jaar,ft_omschrijving,auteursrechten_vervaardiger_naam
,1113e902-b689-4331-b44f-1944427b9a4e,,{0.63629},{HGA001435628},1979,"Scheveningseweg, begraafplaats 'Ter Navolging'","Kempff, P.G."
,11167f81-4b6f-4037-ae17-d5dd26fd2823,,{1.52977},{HGA001138224},1968,Thijs de Haan in actie tijdens de veldhandbalwedstrijd 'Operatie' - 'Miloc',"Brugge, G.J. ter"
,1125c605-f9dc-4cb5-b6e1-14fb9572a97d,,{1.23355},{HGA001022642},1979,"Viering van het 25-jarig dienstjubileum van mevrouw drs. A.M.J. de Haan in de tentoonstellingszaal van het gemeentearchief. Het hoofd van de afdeling Inventariatie, drs. M. van Doorn, spreekt de jubilaresse toe. V.l.n.r. : mevrouw drs. A.M.J. de Haan; gemeentearchivaris drs. H. Bordewijk; G.A. Kooy; P. Wander; mevrouw J.F.M. Wentholt; de heer van Doorn en drs. C.H. Slechte","Kempff, P.G."
,11295fd9-c542-4739-918e-9dd70a87baaf,,{0.47145},{HGA001439197},1975,"Malakkastraat nr. 13, voorkamer van het huis van de grafisch ontwerper Jos Lammers en zijn gezin","Kempff, P.G."
,115901e3-322f-4fd7-9d72-8416373d7388,,{5.12501},{HGA001418009},1985,"Hofvijver gezien naar de Vijverdam, links de parlementsgebouwen","Fortuin, Albert"
,116592a9-4a98-4f56-80e0-0e252cee7bf1,,{0.44503},{HGA001414304},1982,Leeghwaterkade richting Fijnjekade,"Kempff, P.G."
,11685a33-a95f-4a8a-845f-3b2f9c6a4492,,{6.02306},{HGA001133034},1994,Dedelstraat nr. 25,"Kempff, P.G."
,11739b57-00e6-45af-819d-39c26f999bdf,,{5.05145},{HGA001197901},2004,"Boulevard, SprookjesBeelden aan Zee, een vrij toegankelijke permanente tentoonstelling van het museum Beelden aan Zee, geopend op 9 juni 2004, met beelden van Tom Otterness. Op de voorgrond 'Haringeter'","Swinkels, Antoinette"
,117a8eb0-3b53-4797-9e0e-19bb2294007f,,{870300},{HGA001870300},1975,"Eerste haven, Hektrawler Willem van der Zwan, SCH 302, rederij W. v.d. Zwan & Zn, detail","Paans, M."
,11857040-e8a5-4921-aba8-06edadedc5ab,,{0.11879},{HGA001037707},1981,"Boddaertstraat, gezien van de Linnaeusstraat naar de Jan ten Brinkstraat","Kempff, P.G."
,119631cf-5549-41bc-aeb3-228861d02742,,{0.49662},{HGA001421728},1982,Neherkade bij de Slachthuislaan,"Kempff, P.G."
,119f8eae-74b9-43a8-9d73-af369c229b91,,{0.14682},{HGA001058744},1980,"Camera Obscurastraat nrs. 99-81, gezien naar de Vosmaerstraat","Kempff, P.G."
,11a37294-231f-4eb4-a123-cd07a437208b,,{0.67244},{HGA001440417},1980,Stastokstraat nrs. 52-54,"Kempff, P.G."
,11a38b91-036b-4f81-9431-7f88357541b1,,{0.28016},{HGA001400879},1980,"Hildebrandstraat nrs. 34-40, rechts de Stastokstraat, links richting Goeverneurplein","Kempff, P.G."
,11bbc9ee-d012-4df1-b20a-dc01a3f82d18,,{0.12645},{HGA001056713},1981,"Bresterstraat nrs. 2-90, gezien van de Capadosestraat naar de Laakkade. Op de voorgrond hondenkapsalon Wolvers","Kempff, P.G."
,11c693a3-57a5-4c82-a930-f2b311095074,,{0.40845},{HGA001410652},1982,"Laakhaven, vanaf de Waldorpstraat kruising Viaductweg","Kempff, P.G."
,11d291d2-fb21-4890-8883-787a7cd52294,,{860262},{HGA001860262},1945,Overwinningsparade op de Laan van Meerdervoort,"Biegstraaten, F.W.H."
,11de0b76-6cb2-41ce-ac54-e2c8ad5d2745,,{883151},{HGA001883151},1975,"Luchtfoto Centrum, op de voorgrond het Buitenom, evenwijdig daar aan de Prinsegracht, gezien naar het Westeinde; rechts het hofje van Nieuwkoop; op het braakliggende terrein zal later het Westeinde Ziekenhuis gebouwd worden",Stokvis
,11f16784-543d-4883-8224-d6b112a93534,,{0.74148},{HGA001245604},1978,Viviënstraat nrs. 88-90,"Kempff, P.G."
,11f2f060-0cc4-4ac1-902d-14b3c91430c4,,{1.21173},{HGA001020524},1976,Opening van de tentoonstelling 'De Schilderswijk getekend' in het gemeentearchief. 'Verboden te roken',"Kempff, P.G."
,11fc002c-8fd4-47ab-ae29-2e136935f61c,,{0.72003},{HGA001444706},1982,Van der Hoopstraat nrs. 29-19,"Kempff, P.G."
,1203f3f3-1713-487b-a917-c1c29f8d56dc,,{0.84114},{HGA001259553},1979,"Zoutmanstraat nr. 53D, hoek Prins Hendrikplein nr. 1, pianohandel Mossel en Versteege","Kempff, P.G."
,120903f0-ac55-4ab9-8c90-cbfe48eafdc8,,{0.69553},{HGA001442317},1990,"Toon Dupuisstraat, Houthaghe","Kempff, P.G."
,120a8c60-c17e-40c1-9c95-e098787a70a0,,{0.59563},{HGA001431578},1981,"Prudens van Duysestraat, gezien van de Guido Gezellestraat naar de Schimmelweg","Kempff, P.G."
,1214e0d5-22cf-422b-8c55-76bb83c74e4c,,{0.76079},{HGA001247765},1993,"Walchersestraat, even zijde gezien van de Markensestraat in de richting van de Pluvierstraat","Kempff, P.G."
,122e1008-0738-452a-8d63-eea21944ab3d,,{0.55983},{HGA001428034},1980,"Plaats nrs. 33-29, gezien naar het Buitenhof","Kempff, P.G."
,122f21b4-08e8-46c7-8e60-766f3ca4abe3,,{870182},{HGA001301782},1975,Passage,Stokvis
,122f8104-9e95-4078-93c6-a36e1d2de023,,{0.46759},{HGA001439061},1982,Lulofsstraat,"Kempff, P.G."
,1234aba1-4d1a-44a2-bab0-fa647904c0b5,,{1.16665},{HGA001053962},1966,Pseudo-raadsvergadering van Jongeren in de raadzaal aan de Javastraat. Een 'VVD-ster' aan het woord over de afsluiting van de boulevard,Stokvis
,124e6723-79af-4725-927a-18b434b33d78,,{0.88007},{HGA001088007},1982,"Wassenaar, Clingendael; voor- en zijgevel van het huis tijdens de restauratie","Kempff, P.G."
,124ee9ec-5d39-401c-aa63-760050c42455,,{0.74321},{HGA001245982},1982,Vliegwielstraat nrs. 67-1 vanaf de Klepstraat naar de Broekslootkade,"Kempff, P.G."
,1256562c-bc7d-446a-a2aa-d01c20a572b7,,{0.31441},{HGA001404283},1981,"Jan Wapstraat, gezien van de Aarnout Drostlaan richting De Genestetlaan","Kempff, P.G."
,1256cec7-1827-48e2-9a6b-90a6f3dab60f,,{0.16156},{HGA001060145},1981,"Convivastraat nrs. 48-110 en 117-53, gezien van de Isingstraat naar de Antheunisstraat","Kempff, P.G."
,125e5554-c0b8-4f01-80bd-eb618e6ca000,,{870249},{HGA001870249},1975,"Zeilstraat, kat op een muurtje","Paans, M."
,1262a9d5-cf10-48b4-8251-59379fefce23,,{1.17502},{HGA001054796},1968,"De voorzitter van de Nederlandse Federatie voor Bejaardenzorg, dr. H.W. Tilanus, overhandigt mevrouw E.K. Drüge een zilveren bonbonschaaltje omdat zij het vijfduizendste diploma bejaardenhelpster van de federatie heeft verworven",Stokvis
,12636e53-fa82-4a32-8784-17950f3a52de,,{0.27988},{HGA001400851},1979,Hildebrandstraat hoek Schimmelweg,"Kempff, P.G."
,12711a2e-4e15-473a-a976-60d4d7ba8d08,,{0.28003},{HGA001400866},1979,Hildebrandstraat nrs. 174-186,"Kempff, P.G."
,1271339d-cf59-45ca-862e-7664fa175df9,,{860316},{HGA001860316},1945,"Grote Marktstraat, geallieerde stafwagen met vermoedelijk Prins Bernhard aan het stuur","Biegstraaten, F.W.H."
,127ddd7c-c1db-4043-a2ee-f212fbc8947d,,{0.27045},{HGA001400249},1981,"Haverschmidtstraat, gezien van de Isingstraat","Kempff, P.G."
,128c8209-027a-46fd-a227-3a1a4dedd2f0,,{0.42201},{HGA001412008},1964,"Laan van Nieuw Oost Indië, ter hoogte van nr. 8-8A (links), gezien naar Voorburg",Stokvis
,12940f80-3657-4182-a8eb-60bc3ec4800a,,{883205},{HGA001883205},1980,"Hooftskade nr. 195; Haags Krachtsportcentrum H.K.V.-Simson-K.D.O., voorheen distilleerderij 'De Ooievaar'","Vries, Jan de"
,129a08d5-c82d-4b86-ab5d-357ef0af383e,,{0.06831},{HGA001032689},1978,"Apeldoornselaan, gevel van het voormalige kledingmagazijn Lijnkamp, thans Johan Maasbach World Mission","Kempff, P.G."
,129c1f7b-8e23-4dbd-961f-8ae076bf226e,,{0.45006},{HGA001414806},1960,"Zoetermeer, Oranjelaan ter hoogte van nr. 97, met een moeder en vier kinderen. Links De Spar, midden een agentschap van Dagblad Het Binnenhof",Stokvis
,129d6399-ec67-4af9-92f6-1e156657f0e1,,{860291},{HGA001860291},1945,Rijswijkseplein; intocht geallieerden,"Biegstraaten, F.W.H."
,12a4ed76-e74a-472d-a508-5dc4389ebc57,,{870649},{HGA001870649},1975,"Lange Voorhout nr. 34, Koninklijke Bibliotheek, gevel, detail","Paans, M."
,12ac6665-8582-494d-bb3c-307fbe388410,,{0.86327},{HGA001262506},1975,"Perspectieffoto Centrum-Spui, gezien vanaf het gebouw Lummus aan de Turfmarkt naar het oosten, met de bouwput bij het Prins Bernhardviaduct en op de achtergrond het gebied rond de Prinses Beatrixlaan","Kempff, P.G."
,12b92266-f5a1-4d71-974e-50ab8e009a61,,{1.13996},{HGA001051313},1954,"Conferentie van de ministers van Buitenlandse Zaken van de Benelux landen in het ministerie van Buitenlandse Zaken. V.l.n.r. J. Beck (Luxemburg) mr. J.W. Beyen en Spaak (België), minister P.H. Spaak geeft een verslag aan de journalisten",Stokvis
,12bdf8ea-72b9-4c52-9628-abb35ea42b79,,{5.02418},{HGA001194964},1984,"Wagenstraat, de moskee tijdens een dienst",Stokvis
,12c15bbf-1a02-49f4-92c1-65c27e224a42,,{870273},{HGA001870273},1975,"Keizerstraat nr. 131, Drogisterij De Gaper","Paans, M."
,12c25d70-e418-4811-8848-0c619797ebfa,,{304745},{HGA001310045},2008,"Verwoldestraat in afbraak, gezien richting Ulenpasstraat. Afvoeren van puin","Postma, R."
,12c35912-d361-4199-a4ae-6fd434daf75c,,{0.05549},{HGA001031410},1977,Alberdingk Thijmstraat,"Kempff, P.G."
,12c4d53f-aa3c-451d-a11f-bdf1dd08b212,,{0.05885},{HGA001031746},1981,"Allard Piersonlaan nrs. 137-53, gezien van de Isingstraat naar de Antheunisstraat","Kempff, P.G."
,12c87738-4a56-477b-962b-415a21260a34,,{1.27615},{HGA001026886},1984,"Tentoonstelling 'Het Verheerlijkt Den Haag', georganiseerd door het Gemeentearchief in Pulchri Studio, Lange Voorhout nr. 15","Kempff, P.G."
,12cf0991-206e-4e4a-87aa-a19c933fd748,,{0.51417},{HGA001423482},1970,"Noordeinde nrs. 44-46, voorheen J.A. Krul",Stokvis
,12d0101e-883e-4892-a019-96043d224616,,{5.05157},{HGA001197913},2004,"Tentoonstelling Den Haag Sculptuur 2004 ('Giganten - Europese smaakmakers'), een kunstwerk (twee vingers vormen een V) aan de rand van de Hofvijver","Swinkels, Antoinette"
,12d3d238-47fe-45d3-a869-cc9a383f56cb,,{870388},{HGA001870388},1975,"Christinalaan, zijstraat van de Cantaloupenburg","Paans, M."
,12da4525-1c90-444f-b4de-f173e7e47be9,,{870035},{HGA001301635},1975,"Groenmarkt, interieur van de nieuwe raadzaal",Stokvis
,12e0b2e4-4704-4061-930e-01f67897f600,,{870302},{HGA001870302},1975,"Hektrawler, detail","Paans, M."
,12e22acd-2897-4384-8677-6f7fb6393f7f,,{1.17256},{HGA001054551},1967,"Gouden feest van het Maerlantlyceum, Johannes Bildersstraat nr. 11. In de aula luisteren het schoolkoor en het schoolorkest o.l.v. de heer W.H. Kotterman, de bijeenkomst op",Stokvis
,12e2d0cb-b408-4b45-a94e-ba42e8b7e77a,,{870760},{HGA001870760},1970,"Perspectieffoto van de Boslaan met het tracé (rechts) waar de Utrechtsebaan moet komen, gezien vanaf de Bezuidenhoutseweg in de richting van de Benoordenhoutseweg",Stokvis
,12ec6439-da25-49f3-8148-9e861995313d,,{820489},{HGA001256114},1989,Luchtfoto Scheveningen. Centraal het verzorgingstehuis 'Het Uiterjoon' aan de Vissershavenstraat. Rechtsboven de vuurtoren.,Delta-Phot
,12fede1a-e29c-4d9f-bbd4-666f91229f95,,{1.51038},{HGA001136227},1953,"Reinigingsdienst, bevestiging van bellen aan de vuilniswagens",Stokvis
,1308c90a-878b-43a2-a8e6-2e3ae3a0bf98,,{0.40976},{HGA001410783},1981,"Laakweg nrs. 169-152, gezien naar de 1e Laakdwarsweg","Kempff, P.G."
,13166665-b659-41d1-8986-e3b12e9aef82,,{1.18684},{HGA001055975},1972,"Onthulling van een schaalmodel van het Goudse stadhuis, bestemd voor de miniatuurstad Madurodam. Geheel links: ideemaker Pieter; in het midden de burgemeester van Gouda P. van Dijke, en rechts de loco-burgemeester van de miniatuurstad Harmen Heslinga",Stokvis
,1319980b-dd29-487a-8ec2-9c70f67f50c6,,{1.16692},{HGA001053989},1966,"De wethouder van Openbare Werken en Verkeersaangelegenheden, mr. A.J. Dankelman, stelt de maquette betreffende het Zeeleidingproject in werking, die de loop van het afvalwater naar zee volgens het nieuwe systeem weergeeft",Stokvis
,131e5980-cf12-48ef-8247-8e407032dbd6,,{0.18278},{HGA001062259},1975,"Elandstraat nr. 144, detail","Kempff, P.G."
,13299d7c-3bb7-4f51-a4d8-5ff30391eeb9,,{860210},{HGA001860210},1945,"Prinsegracht, gezien naar de Grote Markt. Duitsers fietsen nog gewapend door de stad","Biegstraaten, F.W.H."
,132b5cd0-91e1-4e16-a6a8-25c8867af982,,{0.19960},{HGA001063935},1982,"Fijnjekade tot en met nr. 23, hoek Van Leeuwenhoekstraat","Kempff, P.G."
,132c5faa-65f5-4f0b-9d50-79003aa6b7be,,{0.84499},{HGA001260213},1960,"Zuiderpark, het schoonmaken van de plasvijver",Stokvis
,133231f2-ca93-4806-855e-09b3fff02196,,{1.16076},{HGA001053376},1964,"Opening van de NAVO-conferentie in de Ridderzaal door mr. J.M.A.H. Luns, minister van Buitenlandse Zaken",Stokvis
,13390809-f152-4500-a8d0-a09bafefd017,,{0.62049},{HGA001434054},1980,Schaapherderstraat nrs. 23-13,"Kempff, P.G."
,133a903e-f934-40eb-b4d7-1f457668b552,,{870565},{HGA001870565},1975,"Lange Voorhout nr. 2, Kloosterkerk, gedenksteen","Paans, M."
,133ad8c2-4702-4203-9ca1-23c793d55eed,,{870676},{HGA001870676},1975,"Carnegieplein nr. 2, Vredespaleis, gezien vanaf het plein","Paans, M."
,13404f3c-9090-4a4b-8086-855015cf46a9,,{1.16937},{HGA001054232},1967,Huwelijk van prinses Margriet en mr. Pieter van Vollenhoven. Burgemeester mr. H.A.M.T. Kolfschoten overhandigt het bruidspaar een witlederen cassette met het trouwboekje,Stokvis
,134a7221-9967-42b7-8ba0-2b0d96c0468c,,{870571},{HGA001870571},1975,"Stadhouderslaan nr. 41, Gemeentemuseum, entree","Paans, M."
,134abccd-882f-4032-a636-99e783c67648,,{0.67994},{HGA001238907},1982,"Stieltjesstraat nr. 942 en lager, achterzijde vanaf de Laakkade","Kempff, P.G."
,134db30f-56d9-4258-b5fb-abd216b9a4ec,,{0.58117},{HGA001430134},1953,Grote Markt met grote verkeersdrukte richting Prinsegracht,Stokvis
,135bff9d-b59d-40ae-a882-9828a0307cdf,,{1.66896},{HGA001006801},1970,"Casper A. Schuckink Kool, gemeenteraadslid (Kabouters)",Stokvis
,1360db6c-332d-43c7-b55e-365b4981275d,,{870175},{HGA001301775},1975,"Park met ronde, betonnen, zandbak, onbekend waar",Stokvis
,13698962-0ea4-4022-a2df-6392b142d008,,{0.57683},{HGA001429704},1990,Prins Hendrikplein,"Philips, Lilian"
,136cfa54-3f55-4bb4-ace7-c44ffa7e4f05,,{0.56683},{HGA001428716},1977,"Plein nr. 24, Nieuwe of Litteraire Sociëteit De Witte","Kempff, P.G."
,137871b7-4f2a-4def-8997-ed54ae310a7a,,{0.45276},{HGA001415076},1991,Ligusterstraat nrs. 62-84,"Kempff, P.G."
,137e90f2-d13a-4a4b-af45-c6d99c74a862,,{1.13725},{HGA001051043},1953,"Bij het bereiken van het hoogste punt van het nieuwe gebouw van de Plaatselijke Telefoon Dienst werd door de directeur-generaal der P.T.T., L. Neher, de vlag gehesen. Locatie: Marnixstraat",Stokvis
,1383f76e-d130-497b-b70b-151320429351,,{1.61324},{HGA001001321},1968,E. Burgmans,"Brugge, G.J. ter"
,13880443-57ce-4716-b196-32927919ed63,,{0.67229},{HGA001440402},1980,"Stastokstraat nr. 1, gezien richting Hildebrandstraat","Kempff, P.G."
,138ad579-3679-4361-a498-96d3a851e1ea,,{0.17224},{HGA001061210},1952,"Dr. Lelykade, twee beelden, man en vrouw in Scheveningse klederdracht, op het terras van het stationsgebouw van Radio Holland",Stokvis
,138d7acb-6601-4d11-b061-22b55f43e1ec,,{5.05151},{HGA001197907},2004,"Beeldententoonstelling op Kijkduin, 'Boulevard des Sculptures'","Swinkels, Antoinette"
,138f9d80-3984-4140-bdf1-5ded904ddd0c,,{0.70319},{HGA001443078},1971,"Tullinghstraat nr. 4, gedenksteen voor Jan Ligthart in de gevel van de Jan Ligthartschool",Stokvis
,13a2d0c1-6eeb-44d6-9968-c4f6cd81cbeb,,{1.18553},{HGA001055844},1972,"Herdenking van de kroniekschrijver, wijlen mr. E. Elias bij het te zijner eer geplaatste beeldje 'Flaneur' op het Lange Voorhout. In het midden ziet men oud-burgemeester mr. H.A.M.T. Kolfschoten; geheel links oud-wethouder G.W. Dettmeyer",Stokvis
,13a597de-b8d2-4f21-89c7-9d66c3de7c73,,{870297},{HGA001870297},1975,"Eerste haven, motortrawler SCH 62 Nellie van rederij C. & K. Pronk","Paans, M."
,13b101f3-4a73-45ae-9c6b-730593df4e7f,,{0.07881},{HGA001033734},1978,Barentszstraat nr. 22,"Kempff, P.G."
,13b31cc8-1a57-4058-a70b-0039fd5fb6bf,,{0.36276},{HGA001406101},1981,Karel de Geerstraat nrs. 8 en hoger. Gezien van de Laakkade richting Schlegelstraat,"Kempff, P.G."
,13bd822d-02b2-4901-9219-a331748df01b,,{1.16905},{HGA001054200},1967,"Het programma 'Bruidsspiegel' in het circustheater aan de vooravond van het huwelijk van prinses Margriet en mr. Pieter van Vollenhoven. Het bruidspaar, vergezeld door burgemeester mr. H.A.M.T. Kolfschoten, betreedt de theaterzaal",Stokvis
,13c0f85f-0879-4bc5-8815-0b4e2aadc575,,{1.65471},{HGA001005402},1969,"Tasman Almalik Natadiningrat, ambassadeur van Indonesië",Stokvis
,13d88e81-90ce-42c5-b93d-859a7efc52b6,,{870456},{HGA001870456},1975,"Schrijnwerkersgaarde nr. 148,  bejaardencentrum Carel van den Oeverhuis","Paans, M."
,13d9800b-b87b-40af-99cb-aacc9e008a07,,{0.28032},{HGA001400895},1980,"Hildebrandstraat nrs. 145-139, links de Ferrandweg","Kempff, P.G."
,13db2dd5-2618-4eef-a362-5a06946b3717,,{0.18392},{HGA001062373},1986,"Elboogstraat nr. 80A, Openbare kleuterschool De Klimroos en openbare lagere school Leeghwaterschool","Kempff, P.G."
,13dbbbeb-80e7-4345-afdf-e4796fa955c5,,{0.24215},{HGA001068182},1968,"Groot Hertoginnelaan nr. 8, hoek 1e Sweelinckstraat, bouw van het kantoor van de Nederlandse Vereniging ter bevordering van het levensverzekeringwezen",Stokvis
,13dc602a-061a-4e88-bb92-4e861e9be18c,,{0.74150},{HGA001245606},1978,Viviënstraat nrs. 96-98,"Kempff, P.G."
,13e633a3-87a2-4091-8579-f0c750c15034,,{0.24233},{HGA001068200},1979,"Groot Hertoginnelaan. Plantsoen met Eline Vere, op de achtergrond het nieuwe gebouw voor de Shell en het Metropole-theater, Carnegielaan",Meyer/Stokvis
,13ef51d6-6a8e-42f8-9bcc-8b352bddcb2c,,{0.42433},{HGA001412239},1990,Laan van Vredestein,"Kempff, P.G."
,13f465a3-5187-4864-a2ca-c2b16a19f16c,,{0.52362},{HGA001424427},1991,"Obrechtstraat, interieur Russisch Orthodoxe Kerk","Kempff, P.G."
,13fc57e7-6875-4f28-9e3b-76fa0bd8311a,,{0.80414},{HGA001253618},1982,Waldorpstraat nrs. 310-312,"Kempff, P.G."
,14093f5e-a856-4864-9775-451419261446,,{1.13437},{HGA001050755},1953,"Behandeling gemeentebegroting, enige leden van A.R. en C.H.U. fractie. V.l.n.r. W. Verburg (A.R.), P. den Dulk (C.H.U.), jhr. mr. J.M.M. van Asch van Wijck (A.R.), H. Swart (C.H.U.), H. Smitskamp (A.R. fractievoorzitter), Jac. Dubbeldam (A.R.) wethouder J. van Aartsen (A.R.) en mr. J.J. Hangelbroek",Stokvis
,1412d967-0a4c-4d7d-b684-1bc31a3b3c75,,{0.54895},{HGA001426950},1981,"Pasteurplein nrs. 10, 11 en 12, gezien naar de Ingenhouszstraat","Kempff, P.G."
,14327907-ed92-46f5-8128-37652977f29d,,{883166},{HGA001883166},1979,"Internationale ballonrace, georganiseerd door de Stichting Scheveningen Bad en de Haagse Ballon Club, op het strand in Scheveningen","Vries, Jan de"
,14333e5f-cfac-4b5f-8b61-643abe6f65eb,,{1.18639},{HGA001055930},1972,Dolle Mina's demonstreren voor abortus en laten na aankomst met een huifkar symbolisch ballonnen op op het Malieveld,Stokvis
,14362f3e-4786-4766-ab2e-c0ffe367dce6,,{870013},{HGA001301613},1970,Carnegieplen nr. 2; het Vredespaleis gezien vanaf het plein,Stokvis
,1444b3c1-4ff1-4602-a573-8ceb891e297b,,{1.21985},{HGA001021335},1977,"De Algemene Rijksarchivaris prof. dr. J.L. van der Gouw spreekt drs. H.M. Mensonides toe, die afscheid neemt als gemeentearchivaris in de tentoonstellingszaal van het gemeentearchief, Loosduinseweg nr. 17","Kempff, P.G."
,14470787-34c5-42a8-b0ee-c2460d739967,,{870812},{HGA001870812},1975,"Plaats, gezien in de richting van de Hofvijver",Stokvis
,144decb4-0858-4eea-8da4-cacf9cdbc963,,{0.14614},{HGA001058676},1982,"Calandstraat, oneven zijde vanaf de Waldorpstraat","Kempff, P.G."
,144f71e2-dbb5-4082-9221-9e306f52d226,,{0.86500},{HGA001262679},1975,"Perspectieffoto Centrum-overige, achtergevels van de Zwarteweg, gezien naar de staatsdrukkerij aan de Christoffel Plantijnstraat","Kempff, P.G."
,145645de-d91d-4f82-9f70-e2ae545cb3d2,,{0.51950},{HGA001424015},1982,Noordpolderkade tot nr. 402 (hoek Ketelstraat),"Kempff, P.G."
,1456cb71-51ff-4ebf-b23a-3117053f8795,,{300350},{HGA001305223},2003,"Bisschopstraat nr. 3, Paschalisschool na de brand","Leer, Frank van der"
,1461f4d6-72f0-409d-a2aa-61c720eab9f9,,{0.83549},{HGA001258859},1954,"Zeestraat, nieuwe gebouwen van het hoofdbestuur van de PTT",Stokvis
,14680a41-6662-4557-b470-16eed733fa79,,{0.39732},{HGA001409545},1957,"Korte Voorhout, naar de Bosbrug gezien",Stokvis
,146d26a6-15ff-4e6f-8436-5128286e9c1a,,{0.19329},{HGA001063306},1978,"Forellendaal, winkelcentrum Kraayenstein met de doorgang onder de Kraayensteinlaan","Kempff, P.G."
,146e03b2-1949-4d9f-b674-3a81922ba612,,{1.16078},{HGA001053378},1964,"Opening van de NAVO-conferentie in de Ridderzaal. Van links naar rechts Dean Rusk (minister van Buitenlandse Zaken van Amerika), mr. J.M.A.H. Luns (minister van Buitenlandse Zaken, Nederland) en D.U. Stikker, secretaris-generaal van de NAVO",Stokvis
,14729076-83fe-429d-9f10-8365633afad1,,{0.17526},{HGA001061510},1980,"Douwes Dekkerstraat, ter hoogte van nr. 51 gezien naar de Alberdingk Thijmstraat, stichting voor sociaal cultureelwerk 'De Fram'","Kempff, P.G."
,147d3603-653d-490b-9191-d46a5af96be6,,{1.16673},{HGA001053970},1966,Pseudo-raadsvergadering van Jongeren in de raadzaal aan de Javastraat. Na afloop van de vergadering wordt de tentoonstelling bezocht,Stokvis
,1489c41f-1f8b-42d6-93c5-ca8245c134d0,,{0.29263},{HGA001402118},1991,"Hollanderstraat nrs. 1-15, bij de hoek Koningin Emmakade","Kempff, P.G."
,148b6cb3-5746-456e-b48f-53b441ac3334,,{1.67474},{HGA001007364},1954,"Teun Taal, op 6 maart 1954 50 jaar in dienst bij de rederij A. van der Toorn jzn",Stokvis
,14902e16-8402-44a7-bff1-09d7eae70a24,,{870599},{HGA001870599},1975,"Dunne Bierkade nr. 21, De Pakschuit in wijn en sherry; boven de poort een tegeltableau Pakschuitdienst op Adam","Paans, M."
,1497b807-dda0-424a-a75c-257a5ffd45df,,{1.18491},{HGA001055782},1971,"De minister van Sociale Zaken, drs. J. Boersma, houdt een bespreking in het gebouw van Rijkswaterstaat",Stokvis
,149a213d-c5a9-4fc0-a052-e600b8931d6e,,{0.60596},{HGA001432604},1981,"Rodenbachstraat nrs. 51-1, gezien van de Rosseelsstraat naar de Jan Wapstraat","Kempff, P.G."
,14a34d63-1ec9-454f-9b9e-b0e24be72eba,,{0.57192},{HGA001429215},1981,"Pluvierstraat nrs. 115-1 (l.) en 2-102, gezien naar de Houtrustweg vanaf de Amelandsestraat","Kempff, P.G."
,14a696d3-3479-4d6a-8b9c-13d98405f4c7,,{0.46271},{HGA001416067},1975,"Loosduinseweg nr. 17, Gemeentearchief, hoekje in het archiefdepôt (archief van Fabricage)","Kempff, P.G."
,14b4aaf0-79a6-43ec-afef-997f646a6117,,{870337},{HGA001870337},1975,"Westbroekpark, beeld 'Vrouw' door John Raedecker (geplaatst in 1962)","Paans, M."
,14b82acb-b24a-4c09-aac6-c517ed6018b9,,{0.76201},{HGA001248081},1990,"Visafslagweg hoek Vissershavenweg, Henk Kraan B.V., Paling- en Zalmrokerij","Kempff, P.G."
,14b8e350-3f72-4851-9c95-8e751bb769e6,,{0.40912},{HGA001410719},1981,Laakkade nrs. 167 en hoger gezien van de Lamarckstraat richting Oudemansstraat,"Kempff, P.G."
,14bed7ac-0f23-48ef-a698-e94f51c99d15,,{0.47751},{HGA001439681},1978,Mauritskade-zwembad,Stokvis
,14ce445a-dd1d-44a3-be40-23aff632ab2b,,{0.74508},{HGA001246169},1993,"Voornsestraat, gezien van de Breezandstraat naar de Bruinbankstraat","Kempff, P.G."
,14d1712e-7df6-4078-872b-b6b002de4668,,{0.37027},{HGA001406851},1979,"Kempstraat, sloopgebied; links de Bloemfonteinstraat","Kempff, P.G."
,14d25ad2-a249-4c50-a549-ec86f9fc8b35,,{0.57096},{HGA001429128},1990,"Plesmanweg, uitbreiding Ministerie van Verkeer en Waterstaat","Kempff, P.G."
,14d3fc4c-9438-4f1e-a699-35f3fa298252,,{1.65774},{HGA001005704},1971,J.M. Oud-Dinaux,Stokvis
,14d98b29-77c7-4818-b560-d12276fbb060,,{0.52663},{HGA001424728},1980,"Oltmansstraat, gezien van de Beetsstraat","Kempff, P.G."
,14e40808-b19e-4634-b4cb-37bb150111a0,,{0.20618},{HGA001064592},1981,"Gerard Kellerstraat nrs. 8-2, gezien naar de Laakkade","Kempff, P.G."
,14f8d22d-967d-436f-a3e4-bf1ebdef660f,,{1.18144},{HGA001055436},1970,Burgemeester mr. V.G.M. Marijnen ontvangt de eerste nieuwe haring op het stadhuis aan het Burgemeester De Monchyplein,Stokvis
,14fccd78-4535-4821-856a-bb19a8cf1b54,,{0.22829},{HGA001066797},1956,"Groenmarkt, het opladen van 13 klokken van de Grote Kerk die in Asten (Noord-Brabant) gestemd zullen worden",Stokvis
,150ad9b1-bf4d-4552-8b18-10040eaa1f5d,,{0.24054},{HGA001068021},1978,"Groot Hertoginnelaan nrs. 258-234, gezien van de Voltastraat naar de Archimedesstraat","Kempff, P.G."
,150f6ca0-eecf-4c75-a9f2-52df23dff0f7,,{1.61910},{HGA001001904},1964,"K.D. Dorsman, wethouder van Leidschendam",Stokvis
,15156805-b912-4ca5-a121-032717d9f02a,,{1.14190},{HGA001051500},1955,"Nationale herdenking in de Ridderzaal; tijdens de rede van prof. dr. P.S. Gerbrandy, op de eerste rij in het midden Koningin Juliana en Prins Bernhard",Stokvis
,15167795-452d-4701-8256-35cab85c98d0,,{6.02368},{HGA001133180},1994,"Van Nijenrodestraat nrs. 76-60, tussen de Van der Woertstraat en de Utenbroekestraat","Kempff, P.G."
,1516e131-7ad8-4b6e-b9fe-95aff8d8c86c,,{0.54924},{HGA001426979},1981,"Pasteurstraat nrs. 320-326, gezien van de Zacharias Jansenstraat naar de Jan van der Heydenstraat","Kempff, P.G."
,15172004-b1d0-402c-9d79-e6174ab36a1f,,{870629},{HGA001870629},1975,"Groenmarkt, 't Goude Hooft; op de achtergrond de Bonneterie en de Gravenstraat","Paans, M."
,151cd343-ed51-4e15-b876-7f9817527a9e,,{0.05501},{HGA001031362},1980,"Alberdingk Thijmplein, overzicht met links de nrs. 56-35, gezien van de Beetsstraat","Kempff, P.G."
,1523ad2a-ae30-4342-93f9-356ac143d3cd,,{1.67793},{HGA001007679},1972,"S. van Veenendaal-van Meggelen, staatssecretaris van Cultuur, Recreatie en Maatschappelijk Werk",Stokvis
,152b7653-7826-4de7-ba7e-a7594c94a166,,{0.73164},{HGA001244612},1975,Van Ostadewoningen,"Kempff, P.G."
,152fd750-749f-434f-ba74-5eb0e30f370b,,{860192},{HGA001860192},1945,"Perspectiefopname, op de voorgrond de Monstersestraat en De Heemstraat, links de Grote of St. Jacobskerk, in het midden de Delftselaan","Biegstraaten, F.W.H."
,153491e7-6440-416b-a821-88b9e84b5de2,,{1.22761},{HGA001022111},1978,"De voorzitter van de Abva, J. Dutman, kijkt toe tijdens de ambtenaren-demonstratie op het Binnenhof",Stokvis
,15407b60-3c20-4dd2-9150-cdb85cbd2463,,{0.55876},{HGA001427927},1990,Pinksterbloemplein,"Kempff, P.G."
,15422d9b-97d1-4ff1-aedb-4cb833c76359,,{870326},{HGA001870326},1975,"Plein 1813, Nationaal-Monument, teksten","Paans, M."
